{"action_version":"dxai.action.v1","config_sha256":"aaaaaaaaaaaaaaaaaaaaaaaaaaaaaaaaaaaaaaaaaaaaaaaaaaaaaaaaaaaaaaaa","learner_step":1000,"metrics":{"validation_success_rate":0.75},"model_class":"CandidateQNetwork","observation_version":"dxai.observation.v1","run_id":"example-run","schema_version":"dxai.checkpoint.v1","task_ids":["combat.single_melee.v0"],"upstream_revision":"07385842840437cc9a785b195f5b40b121eaeb1c","weights_sha256":"bbbbbbbbbbbbbbbbbbbbbbbbbbbbbbbbbbbbbbbbbbbbbbbbbbbbbbbbbbbbbbbb"}
